title,author,status,engagements,kudos,comments,hits,rating,words,chapters,status_date,additional_tags
<a href='https://archiveofourown.org/works/31050440'>Love Thy Neighbour</a>,puppybusby,Completed,8417,6676,1741,210556,Explicit,178251,13,2021-11-24,"Alternate Universe - Neighbors, Miscommunication, Fluff, Masturbation, Vaginal Fingering, Cunnilingus, Strap-Ons, Sexy Times"
<a href='https://archiveofourown.org/works/43392936'>of greater marvels yet to be</a>,seabiscuit,Completed,7958,6942,1016,77789,Explicit,47765,5,2022-12-27,"it's a semi-fleabag au, beatrice is a nun, and ava is the horny dirtbag who loves her"
<a href='https://archiveofourown.org/works/43734876'>the definition of insanity</a>,SimplyKorra,Completed,6924,5943,981,118345,Explicit,83453,13,2023-02-01,"Alternate Universe - Canon Divergence, Gay Mess Sister Beatrice (Warrior Nun), Ava and Bea hook up after the fight in s2e1, They then proceed to keep doing it, Oops, Smut, Ava is in love big time"
<a href='https://archiveofourown.org/works/43119381'>the gods we can touch</a>,lescousinsdangereux,Completed,6397,5060,1337,94203,Teen And Up Audiences,49712,7,2022-12-21,"Canon Compliant, Takes place during the two months they spend in Switzerland because come ON, Pre-Season/Series 02, Sharing a Bed, Almost Kiss, more like almost kissES let's be real, Mutual Pining, POV Alternating, (from chapter to chapter), POV Sister Beatrice (Warrior Nun), POV Outsider, POV Ava Silva, Post-Season/Series 02, (for the last chapter)"
<a href='https://archiveofourown.org/works/43692444'>falling (for you) like snow on christmas</a>,totheflame,Completed,6229,5296,933,48468,Mature,58428,9,2022-12-31,"Hallmark AU, ava gets stranded in the snow while trying to win back her ex, beatrice is the brooding love interest with a heart of gold, Slow Burn, content warning: utah"
<a href='https://archiveofourown.org/works/43147122'>we can be brilliant</a>,sxftmelody,Completed,6227,5850,377,60377,Teen And Up Audiences,21305,1,2022-11-18,"Fake/Pretend Relationship, Implied/Referenced Homophobia, Fluff, theyre idiots your honor"
<a href='https://archiveofourown.org/works/43165149'>To climb a tree</a>,Frenchsoda,Completed,5986,5215,771,82268,Explicit,48596,10,2023-01-22,"personal trainer beatrice, personal train wreck ava, Smut, Alternate Universe - Gym, and yes they flip flop!!"
<a href='https://archiveofourown.org/works/43209588'>let me photograph you in this light (in case this is the last time)</a>,SimplyKorra,Completed,4697,3998,699,54090,Mature,53189,12,2022-12-29,"Post-Traumatic Stress Disorder - PTSD, Hurt/Comfort, A lot of physical contact as is the avatrice way, Post-Season/Series 02, Ava has chronic pain, Beatrice has chronic heart eyes, Fluff and Angst"
"<a href='https://archiveofourown.org/works/44135007'>if mine, then yours (and so all yours)</a>",seabiscuit,Completed,3924,3635,289,40270,Explicit,29653,3,2023-01-22,"my government mandated switzerland fic, squirting as character development"
<a href='https://archiveofourown.org/works/26469691'>Standing in a summer haze (are we gonna be okay?)</a>,Galaxiez,Completed,3834,3249,585,64720,Teen And Up Audiences,73437,14,2023-01-22,"lake house retreat au, Angst and Pining, Lots and lots of Pining"
<a href='https://archiveofourown.org/works/25874977'>for all of the times i never could (i'll be good)</a>,orphan_account,Completed,3704,3168,536,67579,Teen And Up Audiences,50125,15,2020-11-26,"Angst and Hurt/Comfort, Angst and Tragedy, Canon-Typical Violence, Emotional Hurt, Blood and Injury, Possible Character Death, Heavy Angst, Demonic Possession"
<a href='https://archiveofourown.org/works/25698862'>Because the Light Is Close</a>,foibles_fables,Completed,3360,2849,511,41831,Mature,25353,5,2020-09-07,"Post-Season/Series 01, Pre-Femslash, Gay yearning, Internalized Homophobia, Explicit Language, Sharing a Bed, Light Angst, Hurt/Comfort, Any Number of Feelings, POV Multiple, Friendship, weird post-crisis road trip"
<a href='https://archiveofourown.org/works/43541728'>between the bitten shelves</a>,that_one_urchin,Completed,3288,3118,170,28566,Explicit,22999,2,2022-12-25,"Alternate Universe - College/University, Sexual Tension, Tutoring, this is eighty percent ava's thirst, twenty percent hot tutor beatrice agenda, Praise Kink, Orgasm Delay/Denial"
<a href='https://archiveofourown.org/works/25413562'>An Apple a Day</a>,"ButterflyGardenia, PaperHatsandPaperBoats",Completed,3083,2355,728,82167,Mature,328166,55,2022-06-07,"attempts at humor, Blood and Injury, Please read Ch 51 notes if youre not into that sort of thing, everything is an AU when season 2 hasn't happened, Rated M only in Chapter 51 & 53"
<a href='https://archiveofourown.org/works/25374133'>The Thread Between Us</a>,surpanakha,Completed,3076,2369,707,66659,Explicit,180995,17,2020-12-31,"Alternate Universe, Some depictions of violence, Awkward Sexual Situations, Implied/Referenced Sexual Assault, graphic depictions of sex, Drama, Lots of drama, and heartache, this has a sprinkling of lilshotgun, Implied/Referenced Rape/Non-con, Angst with a Happy Ending"
<a href='https://archiveofourown.org/works/25753864'>lonely nights</a>,exprsslyfrbidden,Completed,2935,2502,433,33653,Mature,29830,8,2020-09-12,"Emotional Hurt/Comfort, Nightmares, Fluff, Yearning, slight angst, Shenanigans, Cuddling, Sharing a Bed, just all those classic fic tropes, it does get steamy, but it's like a hot shower steamy, not a full on sauna steamy, tasteful steamy, Dreams"
<a href='https://archiveofourown.org/works/43739377'>i sense a rhythm humming in a frenzy</a>,littlepacketofchips,Completed,2886,2614,272,37764,Explicit,33922,6,2023-01-16,"Mutual Pining, 1980s, ava throws a halloween party, and knows a lot about film"
<a href='https://archiveofourown.org/works/28134153'>Snapshots for the future</a>,puppybusby,Completed,2725,2492,233,31574,General Audiences,26172,3,2020-12-26,"Christmas Fluff, Ava and Beatrice? SOFT AND IN LOVE, the others? Chaotic and absolutely shipping them, Fluff and Humor, does it border on crack, perhaps"
<a href='https://archiveofourown.org/works/43847632'>in which the desperation continues.</a>,AdeleDazeem,Completed,2520,2332,188,26948,Mature,22379,4,2023-01-14,"Established Relationship, Alternate Universe - College/University, Alternate Universe - No Powers, more of the same dumbassery really, POV Ava Silva, They're still idiots, Ava's just trying to hit (respectfully), but significantly hornier ones, i swear they are working on it though, alternate title: 'am i more than you bargained for yet?', First Time"
<a href='https://archiveofourown.org/works/43189345'>at least we had today</a>,Reydar,Completed,2393,2240,153,23390,Mature,43751,5,2023-01-08,"Post Season 2, Fluff, Mild Angst, Hurt/Comfort, a lot more angst, Emotional Hurt/Comfort, in that order, reunion scene, followed by a possible future, netflix giveth and netflix taketh away etc etc, what was supposed to be a cute reunion oneshot has since turned into basically season 3, you know how it goes, rated M for chapter 4"
<a href='https://archiveofourown.org/works/25911055'>The Young Martyr</a>,DangersUntoldHardshipsUnnumbered,Completed,2376,1775,601,26087,Explicit,22698,15,2020-08-29,"Art, Post-Canon"
<a href='https://archiveofourown.org/works/43183870'>The Miracles of the Halo</a>,TheBlueMoonStories,Completed,2169,1866,303,47591,Mature,105156,40,2023-01-09,"Post-Season/Series 02, Emotional Hurt/Comfort, Healing, Love Confessions, Forgiveness, Angels, Magical Pregnancy, Miracles, Family Dynamics, Light Angst, Blood and Injury, Blood and Violence, Character Death, Lesbian Sex, Sex"
<a href='https://archiveofourown.org/works/30448410'>Silentium Instrumentum</a>,GleeCastOST,Completed,2046,1548,498,36845,Mature,81609,35,2021-07-08,"Assassin AU, Angst, More angst, Some humour, this is going to be kind of dark, Some Fluff, Enemies to Lovers"
<a href='https://archiveofourown.org/works/43331556'>An Ex For Christmas</a>,heartinvacancy,Completed,2010,1810,200,29263,Mature,41890,13,2023-01-05,"Friends to Lovers, they love each other your honor, no beta we die like shutgun mary, Smut, Eventual Smut, Explicit Sexual Content, Slow Burn, oblivious Ava, like really fucking oblivious, pinning Beatrice"
<a href='https://archiveofourown.org/works/29069901'>Processing</a>,puppybusby,Completed,2003,1849,154,29953,Teen And Up Audiences,35341,4,2021-02-10,"Training, Sharing a Bed, Found Family, ava processes a lot of trauma, Sleepy Cuddles, Nightmares, Making Out, Accidental Choking, as a treat, Praise Kink"
<a href='https://archiveofourown.org/works/43478386'>You Could Make This Place Beautiful</a>,mixtapesandsunsets,Completed,1783,1504,279,26171,Teen And Up Audiences,70053,19,2023-02-16,"Alternate Universe - Canon Divergence, Alternate Season/Series 02, Internalized Homophobia, Fluff, Hurt/Comfort, Swearing, Canon-Typical Violence, Blood and Injury, Angst"
"<a href='https://archiveofourown.org/works/43183590'>uh oh, i'm falling in love</a>",for_evermores,Completed,1772,1649,123,23191,Teen And Up Audiences,20510,6,2022-12-08,"Not Canon Compliant, aka they haven't gotten involved w the samaritans, they haven't gotten called back in, they're just chilling in the alps, scenes from the show will be included, but context/timeline will be altered for Reasons, 5+1 Things, Friends to Lovers, bisexual disaster ava silva, oblivious lesbian sister beatrice, Humor, (I tried), Fluff, Fluff and Humor, Sharing a Bed, Jealousy, First Kiss"
<a href='https://archiveofourown.org/works/36300724'>Worship</a>,puppybusby,Completed,1763,1527,236,41149,Explicit,82326,5,2022-05-11,"Cuddling & Snuggling, General Shenanigans, Baking, we're finally here folks, First Time, the girls are horny, except mary - Freeform, Mary is just vibing and being an agent of chaos, as she should, Other Additional Tags to Be Added"
<a href='https://archiveofourown.org/works/27457942'>paradise lost (and found)</a>,avatricefeels,Completed,1724,1262,462,31378,Teen And Up Audiences,89079,21,2021-05-02,"Angst, Fluff, Emotional Hurt/Comfort, Pre-Canon, Alternate Universe - Pre-Canon, Alternate Universe - Boarding School, the first half is mostly fluff, after that its angsty, Angst with a Happy Ending, a study of how s1 and 2 would play out if ava and bea already dated, ava's mum is awesome by the way and we love her, also kind of how ava would be if she had a loving upbringing, did I mention found family"
<a href='https://archiveofourown.org/works/43793466'>if we could take it all off and just exist</a>,socallmedaisy,Completed,1724,1496,228,14015,Not Rated,32605,2,2023-01-02,"slowburn, Switzerland, there's only one bed, Happy Ending, they're in love they're just idiots"
<a href='https://archiveofourown.org/works/31971451'>Discovery</a>,puppybusby,Completed,1720,1453,267,29195,Mature,65159,5,2021-12-23,"Found Family, Body Exploration, Angst, Hurt/Comfort, Light dom/sub undertones, Major Character Injury, Violence, Injury Recovery, Trauma Recovery"
<a href='https://archiveofourown.org/works/26800210'>Hogwarts vs. Ilvermorny</a>,Aemeth,Completed,1590,1417,173,16228,Mature,22489,7,2022-10-18,"Alternate Universe - Ilvermorny, Ilvermorny, Hogwarts, Alternate Universe - Hogwarts, yes that's right - Freeform, both!, Quidditch, elder gays Mary and Shannon, I had no intention to include Lilith/Camila but then a reader pointed out I already have"
<a href='https://archiveofourown.org/works/30497163'>Vows</a>,puppybusby,Completed,1582,1435,147,25912,Explicit,27553,4,2021-04-20,"Found Family, Road Trips, Nudity, Exploration, Mutual Masturbation, Kinda, choking as a treat"
<a href='https://archiveofourown.org/works/43630062'>We were born sick</a>,AtomicJellyb3an,Completed,1570,1449,121,21064,Explicit,27680,4,2022-12-21,"Slow Burn, Fluff, Eventual Smut, Gay Panic, Repressed Sister Beatrice (Warrior Nun), Praise Kink, its cute but horny, Internalized Homophobia, Soft Sister Beatrice/Ava Silva"
<a href='https://archiveofourown.org/works/31093598'>Declarations</a>,puppybusby,Completed,1485,1341,144,24162,Mature,38090,3,2021-05-21,"Found Family, Road Trips, Drinking & Talking, Drunken Shenanigans, i love that that's a tag, Grinding, Bar Room Brawl, Declarations Of Love"
<a href='https://archiveofourown.org/works/43701712'>everyone but you</a>,box_xx,Completed,1462,1301,161,19555,Mature,34469,12,2023-01-01,"Hurt/Comfort, Amnesia, Angst, Angst and Hurt/Comfort, Happy Ending"
<a href='https://archiveofourown.org/works/44165305'>eternal silence of these infinite spaces</a>,lovepotionnumber5,Completed,1461,1166,295,11967,Mature,51302,4,2023-02-05,"Alternate Universe: The Martian Fusion, Angst, Very brief suicidal thought, putting my dolls into a tin can and throwing it into space"
<a href='https://archiveofourown.org/works/29143812'>The Thorn</a>,GleeCastOST,Completed,1457,1098,359,21459,Mature,82683,30,2021-05-12,"AU, Pirates, Enemies to Lovers, Angst, Angst and Humor"
<a href='https://archiveofourown.org/works/44022102'>Enchanting</a>,AtomicJellyb3an,Completed,1451,1165,286,19235,Explicit,109053,7,2023-02-14,"Alternate Universe - Harry Potter Setting, but you don't need to know anything about harry potter to read, Enemies to Lovers, Smut, They Flip Flop, Ava has a praise kink, its basically canon guys, Ava Silva Being a Dumbass, This was an excuse to put Beatrice in tweed, Beatrice-no-last-name has been given a last name, They're teachers and their students think they're in love, Fluff, Some Plot, mostly yearning, Pining, Angst, i'm such a liar there is plot now, Fuck JK Rowling, there's an epilogue now"
<a href='https://archiveofourown.org/works/43645671'>Secrets and Sins</a>,Confessor123,Completed,1429,1245,184,31889,Not Rated,69182,43,2023-02-09,"Hurt/Comfort, Blood and Injury, Healing, Soft Sister Beatrice/Ava Silva, Fluff and Angst, Sister Camila Ships It (Warrior Nun), Slow Burn, Reya is a bitch, Dark Ava (sort of), Canon-Typical Violence, Fluff and Smut, Repressed Sister Beatrice (Warrior Nun), Sister Beatrice Needs a Hug (Warrior Nun), Gay Mess Ava Silva, Ava Silva Needs a Hug, Lesbian Sex, Post Season 2, Action/Adventure, Post-Canon, Canon Compliant (maybe?), Halo is alive and a bit of a dick"
<a href='https://archiveofourown.org/works/29828931'>Worship</a>,NinesRadScreenname,Completed,1276,1160,116,25008,Mature,30598,10,2021-06-15,"Smut, Eventual Fluff, Internalized Homophobia, Angst and Hurt/Comfort, Porn With Plot, Porn with Feelings"
<a href='https://archiveofourown.org/works/27534508'>Don't leave now that you're here (stay)</a>,puppybusby,Completed,1271,1152,119,13809,Teen And Up Audiences,20915,2,2020-11-16,"Post-Season/Series 01, Flashbacks, no seriously its a lot of flashbacks, Angst, Hopeful Ending, beatrice is sad for most of it im sorry, chapter 2 is MUCH HAPPIER, First Kiss, Injury Recovery"
<a href='https://archiveofourown.org/works/27440572'>Et Fide Peccatum</a>,DangersUntoldHardshipsUnnumbered,Completed,1226,879,347,16719,Explicit,35622,16,2020-11-24,Memory Loss
<a href='https://archiveofourown.org/works/26021605'>We were cursed from the start (the second I let you into my heart)</a>,Galaxiez,Completed,1212,1121,91,11671,Teen And Up Audiences,20842,1,2020-08-21,"Alternate Universe - College/University, Mother Superion is a bartender, There might be too many puns, Ava's an idiot but I love her, They're all just doing their best ok, Shannon is alive and well as she should be"
<a href='https://archiveofourown.org/works/30086415'>I've Got the Magic in Me</a>,GrizzlyBear1710,Completed,1204,949,255,22782,Mature,152407,27,2021-06-30,"Alternate Universe - Hogwarts, Triwizard Tournament, Homophobia, Mild Language, Angst, Fluff, Found Family, Happy Ending, Alternate Universe - Magic, Alternate Universe - Harry Potter Setting, Gay Panic, Bisexual Disaster, Minor Violence, Hogwarts, Durmstrang, Beauxbatons, Slow Burn"
<a href='https://archiveofourown.org/works/25878895'>Something you need</a>,writerofwrongs,Completed,1195,1050,145,18049,Teen And Up Audiences,25583,8,2020-10-11,NA
<a href='https://archiveofourown.org/works/38731206'>Ephemeral Respite</a>,Nardragon,Completed,1144,1093,51,15803,Teen And Up Audiences,31257,7,2022-11-02,Post Season 1
<a href='https://archiveofourown.org/works/43165266'>Find a Way</a>,ForForever19,Completed,1108,1025,83,13947,Teen And Up Audiences,35998,4,2022-11-21,"Post-Season/Series 02, World Travel"
<a href='https://archiveofourown.org/works/43846650'>daydream about me</a>,burningblade,Completed,1062,956,106,15892,Explicit,26769,10,2023-01-16,"Alternate Universe - No Powers, Alternate Universe - Road Trip, Winter Holidays!, lots of fun tropes, Strangers to Lovers, Only One Bed, New Year's Eve, fast burn, Tooth-Rotting Fluff"
"<a href='https://archiveofourown.org/works/32316772'>Two Chalupas, Extra Tears</a>",GleeCastOST,Completed,1048,756,292,16633,Mature,62000,25,2022-07-09,"College AU, taco bell parking lot, Angst, Fluff, Crack, More angst, some mature themes maybe, live mas, chalupa - Freeform"
<a href='https://archiveofourown.org/works/29648820'>The Zealot</a>,GleeCastOST,Completed,1024,750,274,13592,Mature,68236,27,2021-05-27,"AU, Enemies to Lovers, cult?"
<a href='https://archiveofourown.org/works/43178142'>On the Other Side (Of This Wall)</a>,EmilyWritesStuff,Completed,1022,861,161,15753,Mature,26606,12,2023-01-05,"Series Three, Not This Fic Making Me Do Bible Study, Enjoy The Fruits of My Pain, Intense Gay Pining, in cannon, Mary Comes Back (As She Should.)"
<a href='https://archiveofourown.org/works/43672960'>i don't want a lot for christmas (there is just one thing i need)</a>,gilligankane,Completed,1016,880,136,7164,General Audiences,20397,3,2022-12-19,"Christmas, christmas in july, someone said mistletoe and i went feral, then someone said christmas market and i lost my sensibility, THEN someone said 'do they get a cat?' and i blacked out, in this house we drink the 'i respect hans' juice"
<a href='https://archiveofourown.org/works/43628742'>I Won't Run (Every Shipwreck Needs a Setting Sun)</a>,kilowyld,Completed,1013,868,145,18751,Explicit,56693,19,2023-01-18,"Alternate Universe, spy AU, Secret Agent Ava, professor bea, Alternate Universe - College/University, they're idiots your honor, Avatrice, Fluff, Fake Marriage, Fake/Pretend Relationship, Fluff and Angst, Heartache, ava is a giant fuck up so everytime things seem gucci remember there is still time for, the ava silva effect, Slow Burn, Romance, Eventual Smut, Fluff and Smut, Angst and Romance, Blood and Violence, Minor Injuries, Alternate Universe - Spies & Secret Agents, Secret Agent Beatrice"
<a href='https://archiveofourown.org/works/25470907'>This Isn't My Identity</a>,DAgron01,Completed,970,868,102,14292,Teen And Up Audiences,23260,7,2020-07-28,"Ace!Beatrice, Found Family, lots of introspection, Camila is adorable and I love her, Hurt/Comfort, Slow Burn, Awkward Romance, These characters have consumed my life"
<a href='https://archiveofourown.org/works/43466227'>almost is never enough</a>,duhnyell,Completed,938,651,287,19516,Teen And Up Audiences,58556,31,2023-01-15,"Avatrice, Villaneve, Friends to Lovers trope, Friends to Lovers, Friendship, Slow Burn, Pining, College AU, Fluff, Yearning, Fake Dating, falling for a friend, Gay Panic, warrior nun - Freeform, Avatrice AU, Wrong time wrong place, Wrong timing, maybe in a parallel universe, Angst, Heavy Angst, long stretch, first person POV, Going Through It, Pain, Heartbreak, Young Love"
<a href='https://archiveofourown.org/works/28446648'>Galaxies Can't Keep Us Apart</a>,GleeCastOST,Completed,935,591,344,18653,Teen And Up Audiences,106023,40,2021-08-08,"Science Fiction, AU, Angst, Angst and Hurt/Comfort, Fluff and Angst"
<a href='https://archiveofourown.org/works/32395543'>Judgement</a>,NinesRadScreenname,Completed,918,777,141,21590,Mature,73422,13,2022-01-01,"Porn With Plot, Fluff and Smut, Angst and Fluff and Smut, Angst and Humor, Women Being Awesome, Falling In Love"
<a href='https://archiveofourown.org/works/25623715'>Nowhere to Hide</a>,GleeCastOST,Completed,893,823,70,20199,Teen And Up Audiences,29803,17,2020-08-11,"this show is driving me crazy, maybe its the quaratine, angst and a lot of it, some fluff I guess, directly post season 1, not sure where this is going, puns"
<a href='https://archiveofourown.org/works/43686684'>Weary are the Shoulders that Bare the Crown</a>,WhiteravenGreywolf,Completed,893,724,169,16650,Mature,60641,22,2023-02-02,"priory of the orange tree au, Alternate Universe - Royalty, Queen Ava, Protector Beatrice, Slow Burn, Spoilers for the Priory of the Orange Tree, Fluff, Sharing Clothes, Sharing a Bed, Sharing Body Heat, Dragons, Fluff and Smut, Training, wlw with a sword"
<a href='https://archiveofourown.org/works/30850799'>Too Much Time and Not Enough</a>,GleeCastOST,Completed,887,594,293,13159,Teen And Up Audiences,69873,30,2022-02-26,"AU, Time Travel, Magic, Angst, some fluff im not a monster, jk yes I am, Minor Character Death"
<a href='https://archiveofourown.org/works/25868722'>The Fallout</a>,GleeCastOST,Completed,850,678,172,14935,Teen And Up Audiences,41449,23,2020-08-25,"Hurt/Comfort, Angst"
<a href='https://archiveofourown.org/works/26315716'>Between Two Worlds</a>,GleeCastOST,Completed,850,681,169,11078,Teen And Up Audiences,37607,24,2020-09-15,"Hurt/Comfort, Angst, Fluff and Angst"
<a href='https://archiveofourown.org/works/26311438'>The Recipe for Making Love</a>,DangersUntoldHardshipsUnnumbered,Completed,844,525,319,8368,Explicit,33727,20,2020-11-02,Alternate Universe - Chefs
<a href='https://archiveofourown.org/works/37195543'>Vindication</a>,NinesRadScreenname,Completed,821,628,193,14583,Mature,65153,16,2022-06-20,"Angst and Fluff and Smut, Angst and Feels, Mutual Pining, There is definitely smut, Homophobia, Blood and Violence, Blood and Torture, Mission Fic, Sacrifice, Beatrice is a badass, Lilith catches feels, Gotta read it to believe it"
<a href='https://archiveofourown.org/works/27652217'>Beneath a Flag That's Not Our Own</a>,GleeCastOST,Completed,791,540,251,13727,Teen And Up Audiences,100142,30,2021-02-01,"AU, Angst, Fluff and Angst, Intrigue?"
<a href='https://archiveofourown.org/works/43252147'>Heaven is Here</a>,kilowyld,Completed,784,697,87,16140,Mature,38190,19,2022-12-11,"Pain, Loss, Grief/Mourning, Angst, Fluff and Angst, Romantic Soulmates, Slow Burn, Jealousy, Post-Finale, Implied/Referenced Suicide, Oral Sex, Vaginal Fingering, Sex, Cunnilingus, Praise Kink, Backstory, Flashbacks, Character Development, Trauma, Recovery, Imagined Season 3, Gay Mess Sister Beatrice (Warrior Nun), she been holding back some WANTS, I wrote this entire thing to a Message to Bears album, also koda, listen while you read to feel my PAIN, Heaven & Hell, Devils, Avatrice, Plot, Action, possessed beatrice, dark beatrice"
<a href='https://archiveofourown.org/works/34359310'>Tumbling into Magic</a>,Creativityx,Completed,782,543,239,18299,Mature,160464,36,2022-04-21,NA
"<a href='https://archiveofourown.org/works/44203564'>a lover, or something of mine</a>",Smokestarrules,Completed,769,448,321,7213,Teen And Up Audiences,62910,8,2023-01-29,"Alternate Universe - Reincarnation, Fluff and Angst, Angst with a Happy Ending, it's gonna take a while to get there but we Will get there, Mutual Pining, Hurt/Comfort, The Character Deaths Do Not Stick"
<a href='https://archiveofourown.org/works/26112586'>For Those Left Behind</a>,GleeCastOST,Completed,767,577,190,11418,Teen And Up Audiences,39870,21,2020-09-06,"Hurt/Comfort, Angst, Angst and Humor"
"<a href='https://archiveofourown.org/works/44158627'>Oh, I've found my way (I'm coming home)</a>",juststreetspirit,Completed,766,728,38,5731,Mature,20443,2,2023-01-30,"Canon Compliant, ava has a bucket list, set during two months, and after, Reunion, Fluff, Light Angst, Emotional Hurt/Comfort, Dancing in the Rain, They're so Soft With Each Other, lots of longing, Idiots in Love, Post-Canon, Rating Change, Woops, Smut, Camping, ava gets the beach day she deserves"
<a href='https://archiveofourown.org/works/26489794'>Vices</a>,GleeCastOST,Completed,765,567,198,11334,Teen And Up Audiences,45214,21,2020-09-26,"Hurt/Comfort, Angst, Fluff, Fluff and Angst, Avatrice"
<a href='https://archiveofourown.org/works/26669023'>Secret Project X</a>,GleeCastOST,Completed,754,608,146,12346,Teen And Up Audiences,40493,21,2020-10-10,"AU, Fluff and Angst"
<a href='https://archiveofourown.org/works/43623754'>I Know There's Nothing Left To Cling To (But I'm still calling out your name)</a>,heartinvacancy,Completed,715,675,40,6238,General Audiences,24575,4,2022-12-19,"Hanahaki Disease, AU, Angst with a Happy Ending, Not beta'd we die like men standing between Beatrice and Ava"
<a href='https://archiveofourown.org/works/26876491'>Unburden Thy Heart</a>,Ailuroos,Completed,714,624,90,13398,Teen And Up Audiences,81495,4,2021-05-27,"I'm not even gonna tag Adriel, this not about him, i don't think i can do angst really well but there is a bit of it..., fluff too, a lot of tears and hugs, mention of shannon/mary, there is some oc sisters... both current and dead halo bearers, i'm a sucker for soft lilith so there's a bunch of soft lilith here..., Canon-Typical Violence, i'm not gona tag all friendship tags because it's all of them"
<a href='https://archiveofourown.org/works/27221602'>Followed Down an Empty Road</a>,GleeCastOST,Completed,682,536,146,9806,Teen And Up Audiences,41342,19,2020-11-14,"Angst, Fluff and Angst, AU"
<a href='https://archiveofourown.org/works/43942204'>But I Think I Could Love Her (Crimson and Clover)</a>,unburnttkhaleesi,Completed,679,661,18,5203,Mature,20787,1,2022-12-30,"meet cute, michael is a child in this, ava is his big sister, who falls head over heels for his aikido instructor, ava is adopted by jillian and living her best life, they fall in love and read gay poems, and beatrice is a boss, jc is a bit of an asshole in the begining, But he redeems himself, it's a 20k one shot, sorry everyone, AU no halo, AU no demons, Background Shotgun Mary/Shannon Masters"
